{
  "$schema": "https://json-schema.org/draft/2020-12/schema",
  "$id": "https://github.com/mwaddip/santa/schema/santa-wire.vector.schema.json",
  "title": "SANTA wire-tier vector",
  "description": "A committed conformance vector for the wire tier (santa-wire/v1, byte round-trip). The blessed expected is the entry's own bytes_hex (round-trip to self) UNLESS the entry carries expected_bytes_hex (a non-identity round-trip: JVM-canonical output differs from input). Normative companion to docs/specs/wire-tier.md + docs/specs/wire-roundtrip-nonidentity.md.",
  "type": "object",
  "required": ["schema", "op", "blessed_by", "entries"],
  "additionalProperties": false,
  "properties": {
    "schema": { "enum": ["santa-wire/v1"] },
    "op": { "description": "Structure-family slice label.", "type": "string", "minLength": 1 },
    "blessed_by": { "type": "string", "minLength": 1 },
    "entries": { "type": "array", "minItems": 1, "items": { "$ref": "#/$defs/entry" } }
  },
  "$defs": {
    "entry": {
      "type": "object",
      "required": ["name", "kind", "source", "bytes_hex", "version"],
      "additionalProperties": false,
      "properties": {
        "name": { "type": "string", "minLength": 1 },
        "kind": {
          "description": "Serializer selector the runner dispatches on.",
          "enum": ["Constant", "Box", "Transaction", "Header", "SigmaBoolean", "ErgoTree", "BlockTransactions"]
        },
        "source": {
          "description": "Candidate origin for THIS entry (e.g. fleet:serializer/_test-vectors, ergots:fixture-gen/wire, testnet:capture@<range>). Per-entry so one slice (e.g. Box) can hold vectors vendored from several frameworks. Provenance dir follows: framework source => vendored; testnet:/santa: => authored.",
          "type": "string", "minLength": 1
        },
        "description": { "type": "string" },
        "bytes_hex": { "$ref": "#/$defs/hex" },
        "expected_bytes_hex": {
          "description": "OPTIONAL. The blessed JVM-canonical output when it differs from the input bytes_hex (a non-identity round-trip, e.g. a structural ErgoTree re-serialize that re-encodes a lossy-decoded STypeVar name). Absent => round-trip-to-self (the input IS the expected). See docs/specs/wire-roundtrip-nonidentity.md.",
          "$ref": "#/$defs/hex"
        },
        "error": {
          "description": "OPTIONAL. Marks a REJECT entry: the JVM rejects bytes_hex at deserialize, so a conformant runner must error (not produce a round-trip). Mutually exclusive with expected_bytes_hex (a reject has no canonical output). grade_wire: an `errored` actual is nice; producing bytes is the over-accept (coal). See docs/findings/wire-unparsed-soft-fork-boxid.md.",
          "enum": ["errored"]
        },
        "version": { "$ref": "#/$defs/version" }
      },
      "not": { "required": ["error", "expected_bytes_hex"] }
    },
    "version": {
      "type": "object",
      "required": ["activated", "ergoTree"],
      "additionalProperties": false,
      "properties": {
        "activated": { "type": "integer", "minimum": 0, "maximum": 127 },
        "ergoTree": { "type": "integer", "minimum": 0, "maximum": 127 }
      }
    },
    "hex": {
      "type": "string",
      "pattern": "^([0-9a-f]{2})+$",
      "$comment": "lower-case hex, whole bytes, non-empty (a wire object is >= 1 byte)."
    }
  }
}
