{
  "schema" : "santa-wire/v1",
  "op" : "Box.func_type_code",
  "blessed_by" : "jvm:sigma-state-6.0.6",
  "entries" : [
    {
      "name" : "box-func-type-value-reject#0",
      "kind" : "Box",
      "source" : "santa:authored-box-tree-parse",
      "description" : "A bare box whose R4 is typed 0x70 = SFunc(Int => Int) (70 01 04 04 00). Under the node's (3, 3) context the type parses (function types exist from tree v3), but a function has no data encoding: rule 1009 (CheckSerializableTypeCode), and outside a tree there is nothing to degrade, so the JVM rejects. An impl that panics on the type code (sigma-rust before 09a61b05) is red as panicked.",
      "bytes_hex" : "c0843d0008d301000170010404001d823ee9ea823cc80232a19181efad41d66849c33ed5d0d6c5750b8d60f1d66400",
      "error" : "errored",
      "version" : {
        "activated" : 3,
        "ergoTree" : 3
      }
    },
    {
      "name" : "box-int-value-accept#1",
      "kind" : "Box",
      "source" : "santa:authored-box-tree-parse",
      "description" : "A bare box whose R4 is Int 1 (04 02): the control. Round-trip identity.",
      "bytes_hex" : "c0843d0008d301000104021d823ee9ea823cc80232a19181efad41d66849c33ed5d0d6c5750b8d60f1d66400",
      "version" : {
        "activated" : 3,
        "ergoTree" : 3
      }
    },
    {
      "name" : "box-func-const-v2-degrade-accept#2",
      "kind" : "Box",
      "source" : "santa:authored-box-tree-parse",
      "description" : "A bare box whose size-flagged, segregated v2 tree has a constant of type 0x70. Below tree v3 0x70 is no type code: CheckTypeCodeV6 (rule 1018) throws a ValidationException and the tree degrades to UnparsedErgoTree. Round-trip identity.",
      "bytes_hex" : "c0843d1a090170010404000273000100001d823ee9ea823cc80232a19181efad41d66849c33ed5d0d6c5750b8d60f1d66400",
      "version" : {
        "activated" : 3,
        "ergoTree" : 3
      }
    },
    {
      "name" : "box-func-const-v3-degrade-accept#3",
      "kind" : "Box",
      "source" : "santa:authored-box-tree-parse",
      "description" : "A bare box with the same tree at v3: the function type parses, its data cannot (rule 1009), and the tree degrades too. Round-trip identity.",
      "bytes_hex" : "c0843d1b090170010404000273000100001d823ee9ea823cc80232a19181efad41d66849c33ed5d0d6c5750b8d60f1d66400",
      "version" : {
        "activated" : 3,
        "ergoTree" : 3
      }
    }
  ]
}