{
  "schema" : "santa-wire/v1",
  "op" : "Transaction.tree_root_forms",
  "blessed_by" : "jvm:sigma-state-6.0.6",
  "entries" : [
    {
      "name" : "transaction-apply-coll-sigmaprop-root-accept#0",
      "kind" : "Transaction",
      "source" : "santa:authored-sized-tree-requests",
      "description" : "A transaction output whose unsized tree is Apply(Coll(sigmaProp(true)), [0]) (da 14 01 d3 01 04 00). Apply of a collection types as its element, SigmaProp, so rule 1001 passes and the tree parses. Round-trip identity.",
      "bytes_hex" : "0100a19de1b5fa998df5a48630a611180690abad5270c33f23a79baba2f8840d710000000001c0843d00da1401d3010400010000",
      "version" : {
        "activated" : 3,
        "ergoTree" : 3
      }
    },
    {
      "name" : "transaction-apply-int-root-degrade-accept#1",
      "kind" : "Transaction",
      "source" : "santa:authored-sized-tree-requests",
      "description" : "A transaction output whose size-flagged tree is Apply(Int 0, [0]) (08 06 da 04 00 01 04 00): NoType, not a SigmaProp, so rule 1001 degrades the tree. Round-trip identity.",
      "bytes_hex" : "0100a19de1b5fa998df5a48630a611180690abad5270c33f23a79baba2f8840d710000000001c0843d0806da0400010400010000",
      "version" : {
        "activated" : 3,
        "ergoTree" : 3
      }
    },
    {
      "name" : "transaction-context-datainputs-root-reject#2",
      "kind" : "Transaction",
      "source" : "santa:authored-sized-tree-requests",
      "description" : "A transaction output whose unsized tree is 00 db 65 01 fe: PropertyCall(SContext.dataInputs) on CONTEXT, a Coll[Box] root. Rule 1001 fails, and unsized the tree cannot degrade: the JVM rejects. An impl that types an unknown method's result as 'any' passes the root check: the over-accept.",
      "bytes_hex" : "0100a19de1b5fa998df5a48630a611180690abad5270c33f23a79baba2f8840d710000000001c0843d00db6501fe010000",
      "error" : "errored",
      "version" : {
        "activated" : 3,
        "ergoTree" : 3
      }
    },
    {
      "name" : "transaction-context-datainputs-root-sized-degrade-accept#3",
      "kind" : "Transaction",
      "source" : "santa:authored-sized-tree-requests",
      "description" : "The twin: A transaction output whose tree is the same, size-flagged: rule 1001 degrades it. Round-trip identity.",
      "bytes_hex" : "0100a19de1b5fa998df5a48630a611180690abad5270c33f23a79baba2f8840d710000000001c0843d0804db6501fe010000",
      "version" : {
        "activated" : 3,
        "ergoTree" : 3
      }
    }
  ]
}