{
  "schema" : "santa-wire/v1",
  "op" : "Transaction.tree_header_bits",
  "blessed_by" : "jvm:sigma-state-6.0.6",
  "entries" : [
    {
      "name" : "transaction-header-28-accept#0",
      "kind" : "Transaction",
      "source" : "santa:authored-sized-tree-requests",
      "description" : "A transaction output whose size-flagged v0 tree has header 28 (the size bit and bit 5) and body SigmaProp(true). The JVM reads the version and the size and segregation bits and ignores the others; the header byte is kept as stored. Round-trip identity. An impl that refuses the bits, or rewrites the header, diverges.",
      "bytes_hex" : "0100a19de1b5fa998df5a48630a611180690abad5270c33f23a79baba2f8840d710000000001c0843d280208d3010000",
      "version" : {
        "activated" : 3,
        "ergoTree" : 3
      }
    },
    {
      "name" : "transaction-header-48-accept#1",
      "kind" : "Transaction",
      "source" : "santa:authored-sized-tree-requests",
      "description" : "A transaction output whose size-flagged v0 tree has header 48 (the size bit and bit 6) and body SigmaProp(true). The JVM reads the version and the size and segregation bits and ignores the others; the header byte is kept as stored. Round-trip identity. An impl that refuses the bits, or rewrites the header, diverges.",
      "bytes_hex" : "0100a19de1b5fa998df5a48630a611180690abad5270c33f23a79baba2f8840d710000000001c0843d480208d3010000",
      "version" : {
        "activated" : 3,
        "ergoTree" : 3
      }
    },
    {
      "name" : "transaction-header-88-accept#2",
      "kind" : "Transaction",
      "source" : "santa:authored-sized-tree-requests",
      "description" : "A transaction output whose size-flagged v0 tree has header 88 (the size bit and bit 7) and body SigmaProp(true). The JVM reads the version and the size and segregation bits and ignores the others; the header byte is kept as stored. Round-trip identity. An impl that refuses the bits, or rewrites the header, diverges.",
      "bytes_hex" : "0100a19de1b5fa998df5a48630a611180690abad5270c33f23a79baba2f8840d710000000001c0843d880208d3010000",
      "version" : {
        "activated" : 3,
        "ergoTree" : 3
      }
    },
    {
      "name" : "transaction-header-e8-accept#3",
      "kind" : "Transaction",
      "source" : "santa:authored-sized-tree-requests",
      "description" : "A transaction output whose size-flagged v0 tree has header e8 (the size bit and bits 5, 6 and 7) and body SigmaProp(true). The JVM reads the version and the size and segregation bits and ignores the others; the header byte is kept as stored. Round-trip identity. An impl that refuses the bits, or rewrites the header, diverges.",
      "bytes_hex" : "0100a19de1b5fa998df5a48630a611180690abad5270c33f23a79baba2f8840d710000000001c0843de80208d3010000",
      "version" : {
        "activated" : 3,
        "ergoTree" : 3
      }
    },
    {
      "name" : "transaction-header-e0-unsized-accept#4",
      "kind" : "Transaction",
      "source" : "santa:authored-sized-tree-requests",
      "description" : "A transaction output whose unsized v0 tree has header e0 (bits 5, 6 and 7, no size bit). It parses and keeps its header. Round-trip identity.",
      "bytes_hex" : "0100a19de1b5fa998df5a48630a611180690abad5270c33f23a79baba2f8840d710000000001c0843de008d3010000",
      "version" : {
        "activated" : 3,
        "ergoTree" : 3
      }
    }
  ]
}