{
  "schema" : "santa-wire/v1",
  "op" : "Box.unparsed_soft_fork_boxid",
  "blessed_by" : "jvm:sigma-state-6.0.3",
  "entries" : [
    {
      "name" : "box-unparsed-soft-fork-1-byte-body-boxid#0",
      "kind" : "Box",
      "source" : "santa:authored-unparsed-soft-fork-boxid",
      "description" : "ErgoBox whose script is a size-flagged ErgoTree with unknown opcode 0xfd (1-byte body): the JVM stores it as UnparsedErgoTree and re-serializes the box byte-IDENTICAL — the raw tree bytes are the box's propositionBytes, so boxId hashes them. Identity round-trip. An impl that substitutes a Const(true) placeholder + empty constants on the soft-fork wrap (size flag INTACT here, unlike the bare ErgoTree arm) emits different propositionBytes -> different boxId -> UTXO-digest/consensus fork.",
      "bytes_hex" : "c0843d0b01fd000000000000000000000000000000000000000000000000000000000000000000000000",
      "version" : {
        "activated" : 3,
        "ergoTree" : 3
      }
    },
    {
      "name" : "box-unparsed-soft-fork-3-byte-body-boxid#1",
      "kind" : "Box",
      "source" : "santa:authored-unparsed-soft-fork-boxid",
      "description" : "ErgoBox whose script is a size-flagged ErgoTree with unknown opcode 0xfd (3-byte body): the JVM stores it as UnparsedErgoTree and re-serializes the box byte-IDENTICAL — the raw tree bytes are the box's propositionBytes, so boxId hashes them. Identity round-trip. An impl that substitutes a Const(true) placeholder + empty constants on the soft-fork wrap (size flag INTACT here, unlike the bare ErgoTree arm) emits different propositionBytes -> different boxId -> UTXO-digest/consensus fork.",
      "bytes_hex" : "c0843d0b03fd0102000000000000000000000000000000000000000000000000000000000000000000000000",
      "version" : {
        "activated" : 3,
        "ergoTree" : 3
      }
    }
  ]
}